url,account,body,time,hashtag
https://www.instagram.com/p/CZ3j7ygPEc9/,qns_ghd_1006,백신 맞고 밥 하기 힘들땐 포장이 답이지 홍대개미에서 범딜리버리 #외식포장 #순천홍대개미,2월 12일, #외식포장 #순천홍대개미
https://www.instagram.com/p/CX0zuZRlJhE/,hbrgss,생각보다 맛있는 물고기 퇴김👍 #복어 🐡#외식포장,2021년 12월 23일, #복어 🐡#외식포장
https://www.instagram.com/p/COfMwL6FuK6/,seojiyoung_83,2021.5.5 #어린이날 #어버이날 #남편생일 #르배딸기케이크 #청춘닭도리탕과 까만찜닭 #저녁메뉴 #저녁밥상 #외식포장 #청춘닭도리탕 #카페르배,2021년 5월 5일, #어린이날 #어버이날 #남편생일 #르배딸기케이크 #청춘닭도리탕과 #저녁메뉴 #저녁밥상 #외식포장 #청춘닭도리탕 #카페르배
https://www.instagram.com/p/CNZh_LsDhjv/,smil_ejoo,#저녁뭐먹지 오늘은 닭강정! 배가 고파서 허겁지겁 먹다가 반 정도 먹고 사진을 찍었네요ㅠ 맛있어요♥ #외식포장 #닭강정맛집 #양념반후라이드반 #다먹었으니자고싶네,2021년 4월 8일, #저녁뭐먹지 #외식포장 #닭강정맛집 #양념반후라이드반 #다먹었으니자고싶네
https://www.instagram.com/p/CK3iL81Mk5W/,jipbap_yummy,#남이해준음식 오늘은 남편이가 #북경오리구이 를 포장해와서 편한저녁 1년 넘게 가보질 못하고 간간히 포장해다 먹는데 집에서도 맛있어요👍 모밀까지 셋뚜셋뚜인데 배불러서 못먹었네요 고건 내일로~ #돌밥돌밥 하다보니 남이해준음식이 젤 맛나요😭 #외식포장#외식하고파#북경오리맛집#저녁밥상#남이해준게최고,2021년 2월 4일, #남이해준음식 #북경오리구이 #돌밥돌밥 #외식포장#외식하고파#북경오리맛집#저녁밥상#남이해준게최고
https://www.instagram.com/p/CIQvN3JgEwq/,silkyski,밖에 돌아다니고 싶어도 여행이 마려워도 조금만 더 참자!!!! 식사도 집에서!! 👍 #테이크아웃 #외식포장 #외출자제 #여행자제 #코로나 #참자 #혼밥 #카이센동,2020년 12월 2일, #테이크아웃 #외식포장 #외출자제 #여행자제 #코로나 #참자 #혼밥 #카이센동
https://www.instagram.com/p/CE1piIBBy8K/,bowlshop1,"오늘은 포장식! 집에서 그릇에 옮겨 담는데 그사이 아이들이 냠냠..ㅎ 식당에 손님도 없구, 비바람은 몰아치고.. 피해없이 무사히 이 위기가 지나가길🙏🌧😷 우리동네 만두맛집 #바오쯔 #만두국#그릇가게#연어덮밥#외식포장",2020년 9월 7일, #바오쯔 #만두국#그릇가게#연어덮밥#외식포장
https://www.instagram.com/p/B93wZhjlhCg/,chefnewyork_dongtan,매장방문이 꺼려지는 요즘 고객님 리뷰에 위로를 받는다 힘내자!!! 외출걱정없는 날 매장에서 뵙겠습니다~♡^^♡ 이젠 #외식배달 #외식포장 #안되는건없다 #조인쉐프뉴욕동탄점,2020년 3월 18일, #외식배달 #외식포장 #안되는건없다 #조인쉐프뉴욕동탄점
